{
  "schema_version": "0.2",
  "run_id": "example-install",
  "project_id": "example-private-repo",
  "project_name": "Example Private Repo",
  "repo_root": ".",
  "remote_url": "",
  "branch": "",
  "start_commit": "",
  "end_commit": "",
  "run_state": "SIGNABLE",
  "boh_packet_state": "queued",
  "scope": "Demonstrate minimal private repo install.",
  "summary": "Example capsule install packet.",
  "acceptance": ["Example only"],
  "validation": [],
  "docs_updated": ["README.md", "docs/HANDOFF.md", "docs/VARIABLE_MATRIX.md"],
  "readme_state": "audited_no_change",
  "variable_matrix_state": "no_change_verified",
  "decisions": [],
  "risks": [],
  "next_action": "Use this as a reference for a real pilot.",
  "authority": "accepted-current-state",
  "promotion_recommendation": "candidate",
  "source_paths": [".project/runs/example-install.md"],
  "ledger_path": ".project/runs/example-install.md",
  "sensitivity": "private",
  "overrides": [],
  "created_at": "2026-06-30T00:00:00-04:00"
}

