{
  "schema_version": "0.2",
  "run_id": "YYYYMMDD-HHMMSS-project-purpose",
  "project_id": "example-project",
  "project_name": "Example Project",
  "repo_root": ".",
  "remote_url": "",
  "branch": "",
  "start_commit": "",
  "end_commit": "",
  "run_state": "SIGNABLE",
  "boh_packet_state": "queued",
  "scope": "",
  "summary": "",
  "acceptance": [],
  "validation": [],
  "docs_updated": [],
  "readme_state": "audited_no_change",
  "variable_matrix_state": "no_change_verified",
  "decisions": [],
  "risks": [],
  "next_action": "",
  "authority": "accepted-current-state",
  "promotion_recommendation": "candidate",
  "source_paths": [],
  "ledger_path": ".project/runs/YYYYMMDD-HHMMSS-project-purpose.md",
  "sensitivity": "private",
  "overrides": [],
  "created_at": ""
}

