{
  "schema_version": "0.2",
  "run_id": "20260702_coheronia_scaffold_setup",
  "project_id": "coheronia-game",
  "project_name": "Coheronia",
  "repo_root": ".",
  "remote_url": "",
  "branch": "not_repo_yet",
  "start_commit": "not_repo_yet",
  "end_commit": "not_repo_yet",
  "run_state": "SIGNABLE",
  "boh_packet_state": "queued",
  "scope": "Governed scaffold setup for Claude Code/Fable one-shot build.",
  "summary": "Scaffold defines the long-term feature outline, constrained MVP vertical slice, data-driven block/recipe/settlement rules, Project Ops Capsule surface, and Claude Code one-shot prompt.",
  "acceptance": [
    "Scaffold files created",
    "Data JSON parses",
    "Project Ops Capsule minimal install surface present",
    "Prompt created for Fable/Claude Code"
  ],
  "validation": [
    "python scripts/validate_repo.py: expected PASS",
    "Godot playable MVP: not implemented in scaffold"
  ],
  "docs_updated": [
    "README.md",
    "docs/GAME_FEATURE_OUTLINE.md",
    "docs/MVP_VERTICAL_SLICE.md",
    "docs/VARIABLE_MATRIX.md",
    "docs/HANDOFF.md",
    "docs/PROTOCOL_USAGE.md",
    "PROMPT_FOR_CLAUDE_CODE.md"
  ],
  "readme_state": "updated",
  "variable_matrix_state": "updated",
  "decisions": [
    "Treat g1v5 archive as reference/spec context because implementation files were not present.",
    "Constrain v0.1 to playable C/L/R settlement sandbox nucleus.",
    "Use Project Ops Capsule outbox-first workflow."
  ],
  "risks": [
    "Claude/Fable may overbuild without strict MVP boundary.",
    "Godot validation must occur locally."
  ],
  "next_action": "Start Claude Code from outer directory and paste PROMPT_FOR_CLAUDE_CODE.md.",
  "authority": "evidence-only",
  "promotion_recommendation": "defer",
  "source_paths": [
    "README.md",
    "PROMPT_FOR_CLAUDE_CODE.md",
    "docs/GAME_FEATURE_OUTLINE.md",
    "docs/MVP_VERTICAL_SLICE.md",
    "docs/VARIABLE_MATRIX.md",
    "docs/HANDOFF.md",
    "data/blocks.json",
    "data/settlement_rules.json"
  ],
  "ledger_path": ".project/runs/20260702_coheronia_scaffold_setup.md",
  "sensitivity": "private",
  "overrides": [],
  "created_at": "2026-07-02T00:00:00-04:00"
}
