{
  "schema_version": "0.2",
  "run_id": "20260702_coheronia_input_repair",
  "project_id": "coheronia-game",
  "project_name": "Coheronia",
  "repo_root": "B:/dev/Coheronia/coheronia_fable_oneshot_repo",
  "branch": "main",
  "start_commit": "a6654b1",
  "end_commit": "pending-closeout-commit-see-git-log",
  "run_state": "SIGNABLE",
  "boh_packet_state": "queued",
  "scope": "Repair run: restore real keyboard/mouse input for the v0.1 build.",
  "summary": "Operator-reported total input deadness traced to project.godot [input] events serialized as JSON-style dictionaries, which Godot 4 parses as plain data and binds to nothing (InputMap.action_get_events returned 0 events for every action). Rewrote all bindings with Object(InputEventKey/InputEventMouseButton) serialization using physical keycodes; added smoke check input_actions_bound because programmatic Input.action_press() bypasses the InputMap and had masked the defect. Post-fix smoke: 23/23 pass.",
  "acceptance": [
    "Pre-fix diagnostic confirmed root cause: 0 bound events for move_left/jump/mine/interact/save_game",
    "Post-fix: all 15 gameplay actions have at least one real InputEventKey/InputEventMouseButton",
    "Full smoke suite 23/23 PASS, exit 0 (Godot 4.6.1 headless)"
  ],
  "validation": [
    "COHERONIA_SMOKE=1 headless run -> SMOKE RESULT: PASS (23/23), including input_actions_bound"
  ],
  "docs_updated": ["docs/HANDOFF.md"],
  "readme_state": "audited_no_change",
  "variable_matrix_state": "no_change_verified",
  "decisions": [
    "Used physical_keycode (layout-independent) for all key bindings",
    "Kept verification gap closed in-suite: smoke test now asserts device bindings exist rather than only driving actions programmatically"
  ],
  "risks": [
    "Human playthrough still pending for feel/tuning; input path now verified to the InputMap level"
  ],
  "next_action": "Operator relaunch and playthrough; report any remaining dead inputs.",
  "authority": "evidence-only",
  "promotion_recommendation": "none",
  "source_paths": [
    ".project/runs/20260702_coheronia_input_repair.md",
    "docs/HANDOFF.md"
  ],
  "ledger_path": ".project/runs/20260702_coheronia_input_repair.md",
  "sensitivity": "private",
  "overrides": [],
  "created_at": "2026-07-02T12:00:00-04:00"
}
